{
  "days": {
    "2026-10-11": {
      "album": [
        {
          "answer": "apple:tr:1739088799",
          "options": [
            "apple:al:1739088465",
            "apple:al:6782749976",
            "apple:al:1894837142",
            "apple:al:6799944399"
          ]
        },
        {
          "answer": "apple:tr:1794066813",
          "options": [
            "apple:al:1892738151",
            "apple:al:1891943324",
            "apple:al:1794066812",
            "apple:al:1821849174"
          ]
        },
        {
          "answer": "apple:tr:1451566361",
          "options": [
            "apple:al:1706831732",
            "apple:al:1451566360",
            "apple:al:1408505088",
            "apple:al:1534620182"
          ]
        }
      ],
      "catalogVersion": "2026-10-10.2dbd8b64",
      "number": 2,
      "song": [
        {
          "answer": "apple:tr:1837658529",
          "options": [
            "apple:tr:6817260751",
            "apple:tr:1808852932",
            "apple:tr:1837658529",
            "apple:tr:6782749979"
          ]
        },
        {
          "answer": "apple:tr:1771366342",
          "options": [
            "apple:tr:1771366342",
            "apple:tr:1691229801",
            "apple:tr:1648108988",
            "apple:tr:1648411352"
          ]
        },
        {
          "answer": "apple:tr:1440763358",
          "options": [
            "apple:tr:1840081736",
            "apple:tr:1440763358",
            "apple:tr:949250892",
            "apple:tr:1440747285"
          ]
        }
      ]
    },
    "2026-10-12": {
      "album": [
        {
          "answer": "apple:tr:6782749979",
          "options": [
            "apple:al:1837658528",
            "apple:al:6803148720",
            "apple:al:6792630528",
            "apple:al:6782749976"
          ]
        },
        {
          "answer": "apple:tr:1490256995",
          "options": [
            "apple:al:1706831732",
            "apple:al:1496731153",
            "apple:al:1564752132",
            "apple:al:1490256978"
          ]
        },
        {
          "answer": "apple:tr:6792630529",
          "options": [
            "apple:al:1837658528",
            "apple:al:6793888333",
            "apple:al:6803798492",
            "apple:al:6792630528"
          ]
        }
      ],
      "catalogVersion": "2026-10-10.2dbd8b64",
      "number": 3,
      "song": [
        {
          "answer": "apple:tr:1648865575",
          "options": [
            "apple:tr:1648865575",
            "apple:tr:1794066813",
            "apple:tr:1528119630",
            "apple:tr:6762737233"
          ]
        },
        {
          "answer": "apple:tr:1446781787",
          "options": [
            "apple:tr:1446781787",
            "apple:tr:1468137287",
            "apple:tr:1408505419",
            "apple:tr:1394013614"
          ]
        },
        {
          "answer": "apple:tr:1706829387",
          "options": [
            "apple:tr:1706829387",
            "apple:tr:1490256995",
            "apple:tr:6782749979",
            "apple:tr:1564752145"
          ]
        }
      ]
    },
    "2026-10-13": {
      "album": [
        {
          "answer": "apple:tr:1394013614",
          "options": [
            "apple:al:1490256978",
            "apple:al:1706831732",
            "apple:al:1456062834",
            "apple:al:1394013451"
          ]
        },
        {
          "answer": "apple:tr:6815505071",
          "options": [
            "apple:al:1733129984",
            "apple:al:6815505067",
            "apple:al:1892738151",
            "apple:al:1860538546"
          ]
        },
        {
          "answer": "apple:tr:6776482882",
          "options": [
            "apple:al:6776482572",
            "apple:al:6793456209",
            "apple:al:1831207782",
            "apple:al:1771366340"
          ]
        }
      ],
      "catalogVersion": "2026-10-10.2dbd8b64",
      "number": 4,
      "song": [
        {
          "answer": "apple:tr:6762737233",
          "options": [
            "apple:tr:6762737233",
            "apple:tr:6799944400",
            "apple:tr:1821849522",
            "apple:tr:6793888335"
          ]
        },
        {
          "answer": "apple:tr:6788211810",
          "options": [
            "apple:tr:1837658529",
            "apple:tr:6817260751",
            "apple:tr:6788211810",
            "apple:tr:1808852932"
          ]
        },
        {
          "answer": "apple:tr:1795905600",
          "options": [
            "apple:tr:1892738152",
            "apple:tr:1795905600",
            "apple:tr:1803063210",
            "apple:tr:1733130377"
          ]
        }
      ]
    },
    "2026-10-14": {
      "album": [
        {
          "answer": "apple:tr:6785734870",
          "options": [
            "apple:al:6792630528",
            "apple:al:1841344389",
            "apple:al:1808852878",
            "apple:al:6785734869"
          ]
        },
        {
          "answer": "apple:tr:1451567963",
          "options": [
            "apple:al:1538265733",
            "apple:al:1375007287",
            "apple:al:1446781785",
            "apple:al:1451567957"
          ]
        },
        {
          "answer": "apple:tr:1879525016",
          "options": [
            "apple:al:1892738151",
            "apple:al:1879524863",
            "apple:al:1826924327",
            "apple:al:1771366340"
          ]
        }
      ],
      "catalogVersion": "2026-10-10.2dbd8b64",
      "number": 5,
      "song": [
        {
          "answer": "apple:tr:1841344390",
          "options": [
            "apple:tr:6792630529",
            "apple:tr:1808852932",
            "apple:tr:1821849522",
            "apple:tr:1841344390"
          ]
        },
        {
          "answer": "apple:tr:6774039202",
          "options": [
            "apple:tr:1879525016",
            "apple:tr:6774039202",
            "apple:tr:6815505071",
            "apple:tr:1892738152"
          ]
        },
        {
          "answer": "apple:tr:6799944400",
          "options": [
            "apple:tr:6785734870",
            "apple:tr:6799944400",
            "apple:tr:6803148739",
            "apple:tr:6808173126"
          ]
        }
      ]
    },
    "2026-10-15": {
      "album": [
        {
          "answer": "apple:tr:6803798494",
          "options": [
            "apple:al:6803148720",
            "apple:al:6799944399",
            "apple:al:6792630528",
            "apple:al:6803798492"
          ]
        },
        {
          "answer": "apple:tr:1459216694",
          "options": [
            "apple:al:1459216693",
            "apple:al:1273709789",
            "apple:al:1579439167",
            "apple:al:1534620182"
          ]
        },
        {
          "answer": "apple:tr:604748203",
          "options": [
            "apple:al:6793888333",
            "apple:al:604748196",
            "apple:al:1538265733",
            "apple:al:1518843994"
          ]
        }
      ],
      "catalogVersion": "2026-10-10.2dbd8b64",
      "number": 6,
      "song": [
        {
          "answer": "apple:tr:6808173145",
          "options": [
            "apple:tr:6808173145",
            "apple:tr:1794066813",
            "apple:tr:1879525016",
            "apple:tr:1803063210"
          ]
        },
        {
          "answer": "apple:tr:1892738152",
          "options": [
            "apple:tr:1795905600",
            "apple:tr:1803063210",
            "apple:tr:6808173276",
            "apple:tr:1892738152"
          ]
        },
        {
          "answer": "apple:tr:1451567084",
          "options": [
            "apple:tr:604748203",
            "apple:tr:1459216694",
            "apple:tr:1451567084",
            "apple:tr:1681600508"
          ]
        }
      ]
    },
    "2026-10-16": {
      "album": [
        {
          "answer": "apple:tr:1456063581",
          "options": [
            "apple:al:1446781785",
            "apple:al:1490256978",
            "apple:al:1706829225",
            "apple:al:1456062834"
          ]
        },
        {
          "answer": "apple:tr:1790599512",
          "options": [
            "apple:al:1790599503",
            "apple:al:1892738151",
            "apple:al:1733129984",
            "apple:al:1795905599"
          ]
        },
        {
          "answer": "apple:tr:1706832137",
          "options": [
            "apple:al:1538265733",
            "apple:al:1534620182",
            "apple:al:1648865573",
            "apple:al:1706831732"
          ]
        }
      ],
      "catalogVersion": "2026-10-10.2dbd8b64",
      "number": 7,
      "song": [
        {
          "answer": "apple:tr:1821849522",
          "options": [
            "apple:tr:1821849522",
            "apple:tr:1891943326",
            "apple:tr:1808852932",
            "apple:tr:6793888335"
          ]
        },
        {
          "answer": "apple:tr:1273710101",
          "options": [
            "apple:tr:1490256995",
            "apple:tr:1273710101",
            "apple:tr:1518845612",
            "apple:tr:1468137287"
          ]
        },
        {
          "answer": "apple:tr:6817260751",
          "options": [
            "apple:tr:1846753946",
            "apple:tr:1837658529",
            "apple:tr:6817260751",
            "apple:tr:6785734870"
          ]
        }
      ]
    },
    "2026-10-17": {
      "album": [
        {
          "answer": "apple:tr:1846753946",
          "options": [
            "apple:al:6803148720",
            "apple:al:6785734869",
            "apple:al:6792630528",
            "apple:al:1846753945"
          ]
        },
        {
          "answer": "apple:tr:1451567751",
          "options": [
            "apple:al:1408505088",
            "apple:al:1451567750",
            "apple:al:1518843994",
            "apple:al:604748196"
          ]
        },
        {
          "answer": "apple:tr:1803063210",